{
    "id": "BASQUE_CHEESECAKE",
    "name": "Basque Cheesecake",
    "description": "Burnt Basque-style cheesecake with a caramelized exterior and creamy center",
    "price": 14,
    "available": true,
    "components": [
        "cheesecake_batter",
        "whipped_cream",
        "seasonal_fruit_compote"
    ]
}
